{
  "schema_version": "1.0.0",
  "id": "aider",
  "name": "Aider",
  "category": "direct_comparable",
  "status": "active",
  "source_access": "open_source",
  "last_reviewed_at": "2026-06-16",
  "stale_after_days": 90,
  "confidence": "high",
  "similarity_axes": {
    "repo_context_map": {
      "score": 5,
      "evidence_refs": ["aider-repomap"]
    },
    "safe_mutation": {
      "score": 3,
      "evidence_refs": ["aider-repomap"]
    },
    "agent_task_lifecycle": {
      "score": 2,
      "evidence_refs": ["aider-repomap"]
    }
  },
  "similarities": [
    {
      "axis": "repo_context_map",
      "claim": "Uses a concise repository map so the model can reason about code beyond the files currently being edited.",
      "evidence_refs": ["aider-repomap"]
    }
  ],
  "differences": [
    {
      "claim": "Optimized for interactive pair programming rather than durable project governance."
    }
  ],
  "lessons_for_afol": [
    {
      "axis": "repo_context_map",
      "lesson": "Expose compact, ranked project context so agents do not need to read broad docs before acting."
    }
  ],
  "do_not_copy": [
    {
      "reason": "Do not optimize only for chat-driven coding; AFOL also needs durable governance state and validation."
    }
  ],
  "source_refs": [
    {
      "id": "aider-repomap",
      "title": "Aider repository map",
      "url": "https://aider.chat/docs/repomap.html",
      "source_type": "official_doc",
      "claim": "Aider documents a concise repository map containing important classes, functions, types, and call signatures within a token budget."
    }
  ]
}
